{
    "featuriser": {
        "type": "composite",
        "params": {
                "featuriser_list": [
                    {
                        "type": "voxel",
                        "params": {
                        }
                    },
                    {
                        "type": "histogram",
                        "params": {
                            "radius": { "min": 2, "max": 32 },
                            "scale": 0,
                            "num_bins": { "min": 2, "max": 32 }
                        }
                    },
                    {
                        "type": "histogram",
                        "params": {
                            "radius": { "min": 2, "max": 32 },
                            "scale": { "min": 0, "max": 4 },
                            "num_bins": { "min": 2, "max": 32 }
                        }
                    }
                ]
            }
    },
    "classifier": {
        "type": "random_forest",
        "params": {
            "n_estimators": { "min": 1, "max": 32 },
            "max_depth": { "min": 1, "max": 32 },
            "min_samples_leaf": { "min": 1, "max": 32 }
        }
    },
    "training_set": {
        "sample_size_per_label": 10
    },
    "tuning": {
        "num_iterations": 5
    }
}
